{"schema":"iff-observed-confirmations/v1","day":"2026-10-18","monitor_id":"iff-monitor-test","state_key_algorithm":"iff-observed-state-key/v1","fingerprint_version":1,"sealed_at":"2026-10-19T00:10:07.000042Z","endpoint_count":3,"omitted_opted_out_endpoints":1,"uncounted_late_results":0,"totals":{"probes":19,"valid_confirmations":12,"transitions":3},"entries":[{"url":"https://Zeta.example/pay","probes":12,"reachable":12,"protocol_pass":0,"protocol_warn":12,"protocol_fail":0,"protocol_unknown":0,"valid_confirmations":12,"first_probe_at":"2026-10-18T00:05:00.000000Z","last_probe_at":"2026-10-18T23:55:00.000000Z","episodes":[{"episode_id":"5b9e1f3a-7c2d-4e8f-a1b3-c5d7e9f1a3b5","state_key":"10592e16b226f00969b6ab35e5c1018d1da7fb28e65a617812a192f26e21fbd0","set_fingerprint":"e91c4bb1bb5bcbd7aa2a0eed054ad030ceae3257207471877349a5b701ef01a2","outcome":"valid_requirements","opened_at":"2026-10-10T08:00:00.000000Z","opened_in_day":false,"probes":12,"first_probe_at":"2026-10-18T00:05:00.000000Z","last_probe_at":"2026-10-18T23:55:00.000000Z","last_valid_at":"2026-10-18T23:55:00.000000Z"}]},{"url":"https://api.example/a&b","probes":4,"reachable":0,"protocol_pass":0,"protocol_warn":0,"protocol_fail":0,"protocol_unknown":4,"valid_confirmations":0,"first_probe_at":"2026-10-18T06:30:00.000500Z","last_probe_at":"2026-10-18T22:30:00.000000Z","episodes":[{"episode_id":"c2e4f6a8-0b1d-4f3e-9a5c-7e9b1d3f5a7c","state_key":"03084c2c98731f3cfb35e33d7c5ba373997bcc1e9be6b6ead01fac18a785e04b","set_fingerprint":null,"outcome":"no_information","opened_at":"2026-10-18T06:30:00.000500Z","opened_in_day":true,"probes":4,"first_probe_at":"2026-10-18T06:30:00.000500Z","last_probe_at":"2026-10-18T22:30:00.000000Z","last_valid_at":null}]},{"url":"https://api.example/café","probes":3,"reachable":3,"protocol_pass":0,"protocol_warn":0,"protocol_fail":3,"protocol_unknown":0,"valid_confirmations":0,"first_probe_at":"2026-10-18T09:00:00.000000Z","last_probe_at":"2026-10-18T15:00:00.000000Z","episodes":[{"episode_id":"1a2b3c4d-5e6f-4a7b-8c9d-0e1f2a3b4c5d","state_key":"bd2f3bf9bfb6c67f02330d78a20ca65b9cada3324004260e4218f8056806a11b","set_fingerprint":null,"outcome":"non_402","opened_at":"2026-10-18T09:00:00.000000Z","opened_in_day":true,"probes":1,"first_probe_at":"2026-10-18T09:00:00.000000Z","last_probe_at":"2026-10-18T09:00:00.000000Z","last_valid_at":null},{"episode_id":"f0e1d2c3-b4a5-4968-8776-655443322110","state_key":"86e41167d7a3989b3875d9f75a780a04a6a4b271e6db707fda5e1bafebe9d367","set_fingerprint":null,"outcome":"invalid_requirements","opened_at":"2026-10-18T09:00:00.000000Z","opened_in_day":true,"probes":2,"first_probe_at":"2026-10-18T09:00:00.000000Z","last_probe_at":"2026-10-18T15:00:00.000000Z","last_valid_at":null}]}]}