{"schema":"iff-observed-confirmations/v1","day":"2026-10-18","monitor_id":"iff-monitor-test","state_key_algorithm":"iff-observed-state-key/v1","fingerprint_version":1,"sealed_at":"2026-10-19T00:10:02.500000Z","endpoint_count":1,"omitted_opted_out_endpoints":0,"uncounted_late_results":2,"totals":{"probes":35,"valid_confirmations":30,"transitions":1},"entries":[{"url":"https://pay.example/menu&tea/café","probes":35,"reachable":35,"protocol_pass":30,"protocol_warn":0,"protocol_fail":5,"protocol_unknown":0,"valid_confirmations":30,"first_probe_at":"2026-10-18T00:00:12.000001Z","last_probe_at":"2026-10-18T23:59:59.999999Z","episodes":[{"episode_id":"3f1c2b6e-8a9d-4c47-9b1e-0d2f4a6c8e01","state_key":"c73b6af0dd2d6e3bbbf2e513983243c41bf734cbf7c7bc9ee67d4e3123e5faaa","set_fingerprint":"956d8ea767b781c636f6406a19ac1203f36f9f039e996b96d93fd7158c6a8c57","outcome":"valid_requirements","opened_at":"2026-10-17T21:00:00.250000Z","opened_in_day":false,"probes":30,"first_probe_at":"2026-10-18T00:00:12.000001Z","last_probe_at":"2026-10-18T14:59:30.500000Z","last_valid_at":"2026-10-18T14:59:30.500000Z"},{"episode_id":"a7d4e9f0-1b2c-4d3e-8f5a-6b7c8d9e0f12","state_key":"bd2f3bf9bfb6c67f02330d78a20ca65b9cada3324004260e4218f8056806a11b","set_fingerprint":null,"outcome":"non_402","opened_at":"2026-10-18T15:00:00.000000Z","opened_in_day":true,"probes":5,"first_probe_at":"2026-10-18T15:00:00.000000Z","last_probe_at":"2026-10-18T23:59:59.999999Z","last_valid_at":null}]}]}